title,attack_type,attack_type_code,description,year,month,day,Africa,Asia,Australia,Europe,North America,South America,reference_title,reference_url
Unauthorized access at the Thai branch of a Japanese company,Hacking,3,株式会社フジクラ / Fujikura Ltd. - Thailand,2023,1,12,0,1,0,0,0,0,当社タイ王国グループ会社への不正アクセスについて,fujikura.co.jp
Unauthorized access at a school in Australia,Hacking,3,"Mount Lilydale Mercy College - Lilydale, Victoria, Australia",2023,1,11,0,0,1,0,0,0,Hundreds of parents hit by credit card hack at Lilydale school,theage.com.au
Cyber attack on a court in Brazil,Hacking,3,"Belém, Pará, Brazil",2023,1,11,0,0,0,0,0,1,Polícia Científica analisa ataque cibernético ao TJ-PA,belem.com.br
Cyberattack on a government-owned alcohol sales company in Canada,Cyber incident,0,"Liquor Control Board of Ontario (LCBO) - Toronto, Ontario, Canada",2023,1,1,0,0,0,0,1,0,LCBO continues to investigate cybersecurity incident; site and mobile app still down,globalnews.ca
Attack on an IT service provider in Germany,Cyber incident,0,"Adesso SE - Dortmund, North Rhine-Westphalia, Germany",2023,1,11,0,0,0,1,0,0,Current information on the security incident,adesso.de
DDoS attack on the website of the Danish Ministry of Finance,Ddos,2,"Finansministeriet - Copenhagen, Denmark",2023,1,11,0,0,0,1,0,0,Omfattende DDoS-angreb: Finansministeriets hjemmeside vakler,computerworld.dk
Malware at a prison in France,Malware,4,"Maison d'arrêt de Draguignan - Draguignan, Provence-Alpes-Côte d’Azur, France",2023,1,11,0,0,0,1,0,0,La prison de Draguignan victime d'un virus informatique,varmatin.com
Cyber attack at a postal service in the United Kingdom,Hacking,3,"Royal Mail - London, United Kingdom",2023,1,11,0,0,0,1,0,0,Royal Mail tells people not to send post abroad due to 'cyber incident',bbc.com
Unauthorized access at an email marketing provider,Phishing,5,"Mailchimp - Atlanta, Georgia, USA (Fulton County, DeKalb County)",2023,1,11,0,0,0,0,1,0,Information About a Recent Security Incident,mailchimp.com
DDoS attack on a banks in Denmark,Ddos,2,Denmark,2023,1,10,0,0,0,1,0,0,Syv banker mistede kontakten med kunderne - Bankdata udsat for samme angreb som Nationalbanken,avisendanmark.dk
Cyber attack at a materials manufacturer in the UK,Hacking,3,"Morgan Advanced Materials - Windsor, England, United Kingdom",2023,1,10,0,0,0,1,0,0,Notice of Cyber Security Incident,otp.investis.com
Cyber attack on a city government in Virginia,Hacking,3,"Waynesboro, Virginia, USA",2023,1,1,0,0,0,0,1,0,"Ransomware group claims it has infiltrated Waynesboro city government, police data",augustafreepress.com
Cyberattack on a system of a ministry of the state of Amazonas in Brazil,Cyber incident,0,"Ministério Público do Estado do Amazonas (DOMPE-AM) - Manaus, Amazonas, Brazil",2023,1,9,0,0,0,0,0,1,Nota de Esclarecimento,mpam.mp.br
Cyber attack on a college in British Columbia,Hacking,3,"Okanagan College - Kelowna, British Columbia, Canada",2023,1,9,0,0,0,0,1,0,Update: Okanagan College cyber-security incident,okanagan.bc.ca
Customer data of an insurer in Japan offered on the Internet,Unknown,7,"チューリッヒ保険会社 (Zurich Insurance Company Ltd) - Tokyo, Japan",2023,1,9,0,1,0,0,0,0,個人情報漏えいに関するお詫びとお知らせ,zurich.co.jp
"NFT investment firm loses $250,000 after phishing attack",Phishing,5,"NFT Investments Plc - London, United Kingdom",2023,1,9,0,0,0,1,0,0,"NFT Investments hit by US$250,000 phishing attack, implements incident response plan",proactiveinvestors.co.uk
Cyber attack on schools in the United Kingdom,Hacking,3,"Hope Sentamu Learning Trust - Clifton Without, England, United Kingdom",2023,1,1,0,0,0,1,0,0,"Cyber attack at academy chain with schools in York, Selby and Scarborough",uk.news.yahoo.com
Cyber attack on a student online forum in California,Hacking,3,"Irvine, California, USA (Orange County)",2023,1,9,0,0,0,0,1,0,Hackers post disturbing videos to online forum used by UC Irvine students,abc7.com
Cyber attack on a school district in Iowa,Hacking,3,"Des Moines Public Schools - Des Moines, Iowa, USA (Polk County, Dallas County, Warren County)",2023,1,9,0,0,0,0,1,0,Des Moines Public Schools preemptively took the school district’s internet and network services offline,facebook.com
Cyber attack on a city government in Spain,Hacking,3,"Durango, Basque Country, Spain",2023,1,7,0,0,0,1,0,0,Ataque cibernético al Ayuntamiento de Durango,elcorreo.com
Cyber attack on a telecommunications authority in India,Hacking,3,"Controller of Communication Accounts (CCA) - Vijayawada, Andhra Pradesh, India",2023,1,1,0,1,0,0,0,0,Cyberattack on CCA system in Vijayawada,timesofindia.indiatimes.com
Cyber attack on a software for the management of ships and fleets,Hacking,3,"DNV Det Norske Veritas / ShipManager - Høvik, Norway",2023,1,7,0,0,0,1,0,0,"Cyber-attack on ShipManager, a DNV software",dnv.com
Unauthorized access to customer data in a frequent flyer program,Hacking,3,"Flying Blue (Air France, KLM) - Paris, Île-de-France, France",2023,1,6,0,0,0,1,0,0,Air France and KLM notify customers of account hacks,bleepingcomputer.com
Cyber attack on a newspaper in France,Hacking,3,"Charlie Hebdo - Paris, Île-de-France, France",2023,1,5,0,0,0,1,0,0,Le site de Charlie Hebdo a été victime d'une cyberattaque,rtl.fr
Unauthorized access at a mobile phone provider in the USA,Hacking,3,"T-Mobile US - Bellevue, Washington, USA (King County)",2023,1,5,0,0,0,0,1,0,T-Mobile hacked to steal data of 37 million accounts in API data breach,bleepingcomputer.com
Attack on the website of a railway company in the Czech Republic,Cyber incident,0,"České dráhy - Prague, Czech Republic",2023,1,4,0,0,0,1,0,0,České dráhy čelí hackerskému útoku. Web a aplikace Můj vlak mají výpadky,idnes.cz
Cyber attack on a university of applied sciences in Germany,Hacking,3,"Fachhochschule Westküste - Heide (Holstein), Germany (Kreis Dithmarschen)",2023,1,3,0,0,0,1,0,0,(03.01.2023) Angriff auf die IT-Infrastruktur,fh-westkueste.de
Unauthorized access at a university in Denmark,Hacking,3,"Aalborg Universitet (AAU) - Aalborg, Denmark",2023,1,3,0,0,0,1,0,0,Aalborg Universitet hacket igen: Kriminelle havde adgang til navne og mailadresser,version2.dk
DDoS attack on a portal of the French Ministry of Economy,Ddos,2,"Bercy Infos / Ministère de l'Économie et des Finances - Paris, Île-de-France, France",2023,1,3,0,0,0,1,0,0,"Cyberattaque à Bercy : le nouveau guichet unique pour les entreprises paralysé, deux jours après son lancement",lejdd.fr
Voting platform in Martinique shut down after cyber attack,Hacking,3,"Collectivité Territoriale de Martinique CTM - Martinique, France",2023,1,3,0,0,0,1,0,0,Drapeau et hymne : la CTM a suspendu les votes en raison d'une faille de sécurité,martinique.franceantilles.fr
Ransomware at a School district in Massachusetts,Ransomware,6,"Swansea Public Schools - Swansea, Massachusetts, USA (Bristol County)",2023,1,3,0,0,0,0,1,0,Swansea Public Schools canceled on Wednesday after cyber attack,eu.heraldnews.com
Cyber attack on a financial management of a city in Brazil,Hacking,3,"Prefeitura de Pontal do Paraná - Pontal do Paraná, Paraná, Brazil",2023,1,2,0,0,0,0,0,1,ATENÇÃO SISTEMA FORA DO AR PARA EMISSÃO DO IPTU 2023,facebook.com
Cyber attack on a lottery company in Germany,Hacking,3,"Lotto Brandenburg - Potsdam, Brandenburg, Germany",2023,1,2,0,0,0,1,0,0,Nach Cyberangriff kein Lotto-Tipp online mehr möglich,n-tv.de
Cyber attack on an association of municipalities in France,Hacking,3,"Communauté de communes Chalosse Tursan - Saint-Sever, Nouvelle-Aquitaine, France",2023,1,2,0,0,0,1,0,0,Landes : la Communauté de communes Chalosse Tursan victime d’une cyberattaque,sudouest.fr
Cyber attack on a lottery company in Germany,Hacking,3,"Lotto Berlin - Berlin, Germany",2023,1,1,0,0,0,1,0,0,Cyberkriminelle greifen Webseite von Lotto Berlin an,berliner-kurier.de
Ransomware at a hospital in Japan,Ransomware,6,"Uji Hospital / 宇治病院 - Uji / 宇治市, Kansai region / 関西地方, Japan",2023,1,1,0,1,0,0,0,0,不正アクセスによる情報流出の可能性に関するお知らせとお詫び,uji-hp.or.jp
Ransomware at a court in Ohio,Ransomware,6,"Circleville Municipal Court - Circleville, Ohio, USA (Pickaway County)",2023,1,1,0,0,0,0,1,0,"On or about January 1, 2023, the Circleville Municipal Court IT Department identified an issue related to a potential ransomware attack.",circlevillecourt.com
Cyber attack on a election authority in the United Kingdom,Hacking,3,"Electoral Commission UK - London, United Kingdom",2022,1,1,0,0,0,1,0,0,Public notification of cyber-attack on Electoral Commission systems,electoralcommission.org.uk
Cyber attack on a chain of wellness studios in Japan,Hacking,3,"株式会社エーワン東京 (awan tokyo co., ltd) - Tokyo, Japan",2022,1,1,0,1,0,0,0,0,個人情報等の漏洩に関するお知らせ,a1-tokyo.com
Notification service of a Spanish TV station hacked,Hacking,3,"laSexta - Madrid, Spain",2022,1,2,0,0,0,1,0,0,Troleo contra La Sexta: 'hackean' las notificaciones de la cadena de televisión,cronicaglobal.elespanol.com
Portuguese media company hacked,Hacking,3,"Impresa - Paço de Arcos, Portugal",2022,1,2,0,0,0,1,0,0,Portugal's Impresa Media Outlets Hit by Hackers,voanews.com
Twitter account of the Maariv newspaper hacked,Hacking,3,"Maariv - Tel Aviv / תֵּל־אָבִיב–יָפוֹ, Israel",2022,1,3,0,1,0,0,0,0,Jerusalem Post hack part of pro-Iranian Israeli influence op - ex-cyber chief,jpost.com
Website of the Jerusalem Post hacked,Hacking,3,"Jerusalem Post - Jerusalem / ירושלים, Israel",2022,1,3,0,1,0,0,0,0,Jerusalem Post hack part of pro-Iranian Israeli influence op - ex-cyber chief,jpost.com
"Unauthorized access at a hospital in Georgia, USA",Hacking,3,"Wellstar Health - Atlanta, Georgia, USA (Fulton County, DeKalb County)",2022,1,3,0,0,0,0,1,0,Wellstar Health notifies patients of data breach,beckershospitalreview.com
Ransomware at an insurance company in Germany,Ransomware,6,"Unfallkasse Thüringen (UKT) - Gotha, Thuringia, Germany",2022,1,4,0,0,0,1,0,0,Cyberangriff auf die Unfallkasse Thüringen,ukt.de
Data breach at a department store in Singapore,Data breach,1,OG Singapore - Singapore,2022,1,4,0,1,0,0,0,0,OG MEMBER NOTICE ON SECURITY INCIDENT,og.com.sg
Cyberattack on group of cardiologists in Colorado,Cyber incident,0,"South Denver Cardiology Associates - Littleton, Colorado, USA (Arapahoe County)",2022,1,4,0,0,0,0,1,0,"South Denver Cardiology cyberattack, data access impacts 287K patients",scmagazine.com
Ransomware at a hoster for school websites in the USA,Ransomware,6,"Finalsite - Glastonbury, Connecticut, USA (Hartford County)",2022,1,4,0,0,0,0,1,0,Finalsite Statement for the Media,finalsite.com
Ransomware at a county in New Mexico,Ransomware,6,"Bernalillo County - Albuquerque, New Mexico, USA (Bernalillo County)",2022,1,5,0,0,0,0,1,0,BERNALILLO COUNTY HIT WITH SUSPECTED RANSOMWARE ATTACK,bernco.gov
Cyber attack on Balearic health authority,Hacking,3,"Servei de Salut de les Illes Balears (IB-Salut) - Palma, Balearic Islands, Mallorca, Spain",2022,1,1,0,0,0,1,0,0,Cyberangriff gegen balearische Gesundheitsbehörde,inselradio.com
Cyber attack on an industrial company in Switzerland,Hacking,3,"CPH-Gruppe - Perlen, Canton of Lucerne, Switzerland",2022,1,7,0,0,0,1,0,0,Cyber attack on IT systems of the CPH Group,cph.ch
Cyber attack on a hospital in France,Hacking,3,"Pôle Santé Léonard de Vinci - Chambray-lès-Tours, France",2022,1,7,0,0,0,1,0,0,Cyberattaque près de Tours : le Pôle de Santé Vinci victime d'une tentative d'extorsion,lanouvellerepublique.fr
"Cyber attack on a healthcare provider in the Naples area, Italy",Hacking,3,"ASL Napoli 3 Sud - Torre del Greco, Italy",2022,1,8,0,0,0,1,0,0,Attacco all’ASL Napoli 3 Sud blocca i vaccini: perché la Sanità italiana è cyber-fragile,cybersecurity360.it
Cyber incident at a school platform in the USA,Cyber incident,0,"Illuminate Education / IO Classroom - Irvine, California, USA (Orange County)",2022,1,8,0,0,0,0,1,0,'Attempted Security Threat' Disables Software at Some New York Schools,nytimes.com
Cyber attack on the Turkish branch of a pizza chain,Hacking,3,"Domino's Pizza - Istanbul, Turkey",2022,1,1,0,1,0,0,0,0,Siber saldırıya uğrayan Dominos Pizza müşterilerini uyardı: Şifrenizi değiştirin,sozcu.com.tr
Cyber attack on a school district in Illinois,Hacking,3,"Griggsville-Perry School District - Griggsville, Illinois, USA",2022,1,1,0,0,0,0,1,0,Griggsville-Perry School District,facebook.com
Ransomware attack on Florida hospital averted,Ransomware,6,"Jackson Hospital - Marianna, Florida, USA",2022,1,9,0,0,0,0,1,0,Jackson Hospital IT department investigates possible computer hack,mypanhandle.com
Ransomware at a game retailer in Belgium,Ransomware,6,"GM Webstore BVBA / Game Mania - Ranst, Antwerp, Belgium",2022,1,10,0,0,0,1,0,0,Ransomware aanval bij Game Mania,gamemania.be
Cyber attack on the IT service provider of the municipality of Yverdon-les-Bains in Switzerland,Hacking,3,"Yverdon-les-Bains, Canton of Vaud, Switzerland",2022,1,10,0,0,0,1,0,0,INFORMATION SUR UNE CYBERATTAQUE QUI A VISÉ UN FOURNISSEUR DE SERVICES INFORMATIQUES DE LA VILLE,yverdon-les-bains.ch
Cyber attack on school in Germany,Hacking,3,"Evangelische Schule St. Marien - Neubrandenburg, Mecklenburg-Vorpommern, Germany",2022,1,10,0,0,0,1,0,0,Evangelische Schule von Hackern erpresst,nordkurier.de
Cyber attack on a municipality in Italy,Hacking,3,"Comune di Trezzano sul Naviglio - Trezzano sul Naviglio, Lombardy, Italy",2022,1,10,0,0,0,1,0,0,"ATTACCO HACKER AL COMUNE
SISTEMI COMUNALI SICURI E SERVIZI MAI INTERROTTI",facebook.com
Cyber attack on a city in Florida,Hacking,3,"North Port, Florida, USA",2022,1,10,0,0,0,0,1,0,Back from the hack: North Port recovering from City Hall tech breach,yoursun.com
Cyber attack on major car rental company in Brazil,Hacking,3,"Localiza - Belo Horizonte, Minas Gerais, Brazil",2022,1,11,0,0,0,0,0,1,"COMUNICADO AO MERCADO
INDISPONIBILIDADE TEMPORÁRIA DE SISTEMAS",api.mziq.com
Cyber attack on a car dealer in Switzerland,Hacking,3,"Emil Frey Gruppe - Zurich, Canton of Zürich, Switzerland",2022,1,1,0,0,0,1,0,0,Emil Frey-Gruppe wurde Opfer von Cyberangriff,srf.ch
Cyber attack on a school district in Wisconsin,Hacking,3,"Neenah Joint School District - Neenah, Wisconsin, USA (Winnebago County)",2022,1,11,0,0,0,0,1,0,Neenah schools cancel classes Tuesday citing “IT security situation”,wbay.com
Unauthorized access to emails at a West Virginia hospital,Phishing,5,"Charleston Area Medical Center (CAMC) - Charleston, West Virginia, USA (Kanawha County)",2022,1,11,0,0,0,0,1,0,NOTICE OF SECURITY INCIDENT,camc.org
Ransomware at the Upper House of the Argentine Parliament,Ransomware,6,"Senado de la Nación Argentina - Buenos Aires, Argentina",2022,1,12,0,0,0,0,0,1,La web del Senado de la Nación fue otra vez blanco de un ciberataque,tn.com.ar
Cyber attack on a hospital in Japan,Hacking,3,"春日井リハビリテーション病院 (Kasugai Rehabilitation Clinics) - Kasugai, Aichi, Japan",2022,1,12,0,1,0,0,0,0,不正アクセス（疑い）によるシステム障害発生のお知らせ,kreh.or.jp
DDoS attack on a university magazine in the Netherlands,Ddos,2,"observant - Maastricht, Netherlands",2022,1,12,0,0,0,1,0,0,En toen ging de website op zwart,observantonline.nl
Cyber attack on a college in the UK,Hacking,3,"Milton Keynes College Group - Milton Keynes, United Kingdom",2022,1,12,0,0,0,1,0,0,Cyber incident targets Milton Keynes College Group systems,mkcollege.ac.uk
Cyber attack on an umbrella company in the UK,Hacking,3,"Parasol Group - Warrington, England, United Kingdom",2022,1,12,0,0,0,1,0,0,Umbrella company Parasol Group confirms cyber attack as 'root cause' of prolonged network outage,theregister.com
Cyber attack on hospital group in Germany,Hacking,3,"Medizin Campus Bodensee (MCB) - Friedrichshafen, Baden-Württemberg, Germany",2022,1,13,0,0,0,1,0,0,Hackerangriff auf den Medizin Campus Bodensee,medizin-campus-bodensee.de
Destructive malware on computers of Ukainian organizations,Malware,4,Ukraine,2022,1,13,0,0,0,1,0,0,Malware attacks targeting Ukraine government,blogs.microsoft.com
Cyber attack on a school district in Albuquerque,Hacking,3,"Albuquerque Public Schools - Albuquerque, New Mexico, USA (Bernalillo County)",2022,1,13,0,0,0,0,1,0,Cyberattack Closes Schools: A Message from Supt. Elder,aps.edu
Ransomware at the city administration of Pembroke Pines,Ransomware,6,"Pembroke Pines, Florida, USA",2022,1,13,0,0,0,0,1,0,Pembroke Pines deals with ransomware attack,sun-sentinel.com
Unauthorized access to emails of a hospital chain in the U.S.,Phishing,5,"Ballad Health - Johnson City, Tennessee, USA",2022,1,13,0,0,0,0,1,0,Notice of Data Privacy Incident,balladhealth.org
DDoS attack on the internet in North Korea,Ddos,2,North Korea,2022,1,14,0,1,0,0,0,0,N.Korean internet downed by suspected cyber attacks -researchers,reuters.com
1.7 million Polish Army logistics data sets published,Unknown,7,Wojsko Polskie - Poland,2022,1,1,0,0,0,1,0,0,"Gigantyczny wyciek danych z wojska. Ponad 1,7 mln pozycji w internecie",wiadomosci.onet.pl
Ukrainian government websites defaced,Unknown,7,Ukraine,2022,1,14,0,0,0,1,0,0,Ukraine says government websites hit by ‘massive cyber attack’,ft.com
Cyber attack on a payroll and accountancy company in the UK,Hacking,3,"Brookson Group - Warrington, England, United Kingdom",2022,1,14,0,0,0,1,0,0,Dear customers and Suppliers,linkedin.com
Ransomware at US email provider,Ransomware,6,"mail2world - Los Angeles, California, USA",2022,1,14,0,0,0,0,1,0,Shentel email service interrupted by ransomware attack,nationalcybersecuritynews.today
Ransomware at an art center in Canada,Ransomware,6,"Confederation Centre of the Arts - Charlottetown, Prince Edward Island, Canada",2022,1,1,0,0,0,0,1,0,Investigation reveals thousands had info exposed in P.E.I. arts centre data breach,atlantic.ctvnews.ca
Cyber attack on the website of an amateur radio club in Germany,Hacking,3,"Deutschen Amateur-Radio-Club e.V. (DARC e.V.) - Baunatal, Hesse, Germany",2022,1,15,0,0,0,1,0,0,"Deutschland-Rundspruch 3/2022, 3. KW",darc.de
Ransomware at parish in Germany,Ransomware,6,"Heilig Kreuz - Winnweiler, Rheinland-Pfalz, Germany",2022,1,1,0,0,0,1,0,0,Computerkriminelle erpressen Pfarrei,rheinpfalz.de
Cyber attack on an association of municipalities in France,Hacking,3,"Cœur de Maurienne Arvan (3CMA) - Saint-Jean-de-Maurienne, Auvergne-Rhône-Alpes, France",2022,1,16,0,0,0,1,0,0,CYBER-ATTAQUE SUR NOTRE SYSTÈME INFORMATIQUE,saintjeandemaurienne.fr
Cyber attack on Getxo city council in Spain,Hacking,3,"Getxo, Basque Country, Spain",2022,1,17,0,0,0,1,0,0,El Ayuntamiento de Getxo sufre un ciberataque,deia.eus
Ransomware at a grocery chain in Spain,Ransomware,6,"Supermercados Llobet, S.A. (Grup Llobet) - Fruitós de Bages, Catalonia, Spain",2022,1,17,0,0,0,1,0,0,Los Mossos investigan un ciberataque al grupo Llobet que bloquea la contabilidad,cronicaglobal.elespanol.com
$30 million stolen from a crypto exchange,Ransomware,6,Crypto.com - Singapore,2022,1,17,0,1,0,0,0,0,Crypto.com Security Report & Next Steps,blog.crypto.com
Customer data of an online store offered on the Internet,Unknown,7,"Zur Rose Group AG - Frauenfeld, Canton of Thurgau, Switzerland",2022,1,18,0,0,0,1,0,0,Mögliche Datenentwendung beim Online-Shop für Kosmetik- und Körperpflegeprodukte zurrose-shop.ch,zurrosegroup.com
Cyberattack on data from the International Committee of the Red Cross,Cyber incident,0,"International Committee of the Red Cross (ICRC) - Geneva, Canton of Geneva, Switzerland",2022,1,1,0,0,0,1,0,0,"Sophisticated cyber-attack targets Red Cross Red Crescent data on 500,000 people",icrc.org
Cyber attack on a university in Colorado,Hacking,3,"University of Colorado Boulder - Boulder, Colorado, USA (Boulder County)",2022,1,1,0,0,0,0,1,0,"University is victim of cyberattack, prompting campus-wide password changes",cuindependent.com
Cyber attack on the Canadian Ministry of Foreign Affairs,Hacking,3,"Global Affairs Canada - Ottawa, Ontario, Canada",2022,1,19,0,0,0,0,1,0,Global Affairs Canada hit by 'cyber incident' same day warning about Russia was issued,ctvnews.ca
Cyber attack on fund company in South Africa,Hacking,3,"Curo Fund Services - Cape Town, South Africa",2022,1,19,1,0,0,0,0,0,"Old Mutual, Sanlam and Futuregrowth say no customer data was compromised in Curo cyberattack",news24.com
Attack on websites of the Brazilian state of Bahia,Cyber incident,0,"Salvador, Bahai, Brazil",2022,1,20,0,0,0,0,0,1,Ataque derruba 20 sites do governo da Bahia,cisoadvisor.com.br
Customer accounts hacked in a bookseller's online store,Hacking,3,"Thalia Bücher GmbH - Hagen, North Rhine-Westphalia, Germany",2022,1,20,0,0,0,1,0,0,Thalia Onlineshop mittels Brute-Force-Angriff gehackt,tarnkappe.info
Hacker attack on a municipality in Italy,Cyber incident,0,"Comune di Rivoli - Rivoli, Piedmont, Italy",2022,1,20,0,0,0,1,0,0,"Attacco hacker al Comune di Rivoli, bloccati tutti i pc dei dipendenti",lastampa.it
Ransomware at a community college in California,Ransomware,6,"Ohlone College - Fremont, California, USA",2022,1,20,0,0,0,0,1,0,"Data breach at Ohlone College compromises students', staff personal information",ktvu.com
DDoS attack on telecommunications in Andorra,Ddos,2,Andorra Telecom - Andorra,2022,1,21,0,0,0,1,0,0,Andorra Telecom,twitter.com
Cyberattack on a city in France,Cyber incident,0,"Saint-Cloud, Hauts-de-Seine, France",2022,1,21,0,0,0,1,0,0,Hauts-de-Seine. La mairie de Saint-Cloud visée par une cyberattaque,actu.fr
Cyber attack on a clothing company in Mumbai,Hacking,3,"Mumbai, India",2022,1,21,0,1,0,0,0,0,"Hackers attack Worli firm’s server, demand ₹1 lakh in bitcoins",hindustantimes.com
Cyber attack on veterinary clinic in the Netherlands,Hacking,3,"Dierenkliniek Dijkstra - Arnhem, Netherlands",2022,1,21,0,0,0,1,0,0,"Dierenkliniek is al weken offline na hack, eigenaar gaat betalen: ‘Druist in tegen mijn gevoel maar ik kan niet anders’",gelderlander.nl
Unauthorized access at a provider of identity management solutions,Hacking,3,"Okta - California, USA",2022,1,1,0,0,0,0,1,0,Updated Okta Statement on LAPSUS$,okta.com
Hacker attack on a golf club in Germany,Cyber incident,0,"Golfclub Hofgut Praforst e.V. - Hünfeld, Hesse, Germany",2022,1,22,0,0,0,1,0,0,Großer Schock in der Praforst: Golfclub wird Opfer eines Cyberangriffs,osthessen-news.de
Twitter account of the Indian disaster response force hacked,Hacking,3,National Disaster Response Force (NDRF) - India,2022,1,22,0,1,0,0,0,0,NDRF Twitter handle hacked; restored later,indianexpress.com
Cyberattack on a bank in India,Cyber incident,0,"Andhra Pradesh Mahesh Co-Operative Urban Bank - Hyderabad, India",2022,1,1,0,1,0,0,0,0,"Bank had no firewall license, intrusion or phishing protection – guess the rest",theregister.com
Cyberattack on a school district in Pennsylvania,Cyber incident,0,"Pennsbury School District - Fallsington, Pennsylvania, USA",2022,1,23,0,0,0,0,1,0,"Pennsbury’s Computer System Breached, Incident Under Investigation",levittownnow.com
DDoS attacks on Albanian media portals,Ddos,2,"Ora News, Dosja, Syri, Faktor, Lapsi, SportExpress - Albania",2022,1,24,0,0,0,1,0,0,Media Watchdog Calls on Albanian Authorities to Investigate Reports of Cyber Attacks,exit.al
DDoS attacks on a network operator in Belgium,Ddos,2,Belnet - Belgium,2022,1,24,0,0,0,1,0,0,We have faced several short DDoS attacks since 14:00.,twitter.com
Fake emails sent in the name of a Belgian city,Phishing,5,"Verviers, Belgium",2022,1,24,0,0,0,1,0,0,Verviers victime d’une attaque informatique: «C’est de l’usurpation d’identité»,lameuse-verviers.sudinfo.be
Cyberattack on the Belarusian Railway,Cyber incident,0,Belarus,2022,1,24,0,0,0,1,0,0,https://twitter.com/cpartisans/status/1485615555017117700?s=20,twitter.com
Cyberattack on online banking and website of a bank in Germany,Cyber incident,0,"Raiffeisenbank Mainschleife - Steigerwald eG - Volkach, Bavaria, Germany",2022,1,24,0,0,0,1,0,0,Cyberattacke auf Volks- und Raiffeisenbanken legt Onlinebanking lahm,mainpost.de
Twitter account of an Indian airline hacked,Hacking,3,"Go First - Mumbai, India",2022,1,24,0,1,0,0,0,0,Go First Twitter account hacked; airlines working to restore control [details],ibtimes.co.in
Cybersecurity incident at Kentucky hospital,Cyber incident,0,"Taylor Regional Hospital - Campbellsville, Kentucky, USA (Taylor County)",2022,1,24,0,0,0,0,1,0,"Campbellsville hospital says systems, phone lines down due to ‘cybersecurity incident’",kesq.com
Ransomware at a chain of pain centers in Florida,Ransomware,6,"Jax Spine & Pain Centers - Jacksonville, Florida, USA",2022,1,24,0,0,0,0,1,0,Data Breach Notification,jaxspine.com
"Ransomware at Linn County, Oregon",Ransomware,6,"Linn County - Albany, Oregon, USA",2022,1,24,0,0,0,0,1,0,"Linn County affected by ransomware attack, 'several systems are offline'",kpic.com
"Unauthorized access at a healthcare provider in Ontario, Canada",Hacking,3,"Scarborough Health Network (SHN) - Toronto, Ontario, Canada",2022,1,25,0,0,0,0,1,0,SHN Personal Information Public Notice,shn.ca
DDoS attacks on a University of Applied Sciences in Germany,Ddos,2,"FH Münster - Münster, North Rhine-Westphalia, Germany",2022,1,1,0,0,0,1,0,0,Cyberangriffe auf die FH Münster,fh-muenster.de
Ransomware at an engineering consulting company in France,Ransomware,6,"Egis - Guyancourt, Île-de-France, France",2022,1,25,0,0,0,1,0,0,Ransomware : Egis a stoppé la cyberattaque dans sa phase finale,lemagit.fr
Emotet and fake email at a public swimming pool in Japan,Phishing,5,"秋葉山公園県民水泳場 (Akibayama Park Prefectural Swimming Pool) - Wakayama, Japan",2022,1,1,0,1,0,0,0,0,不審メールに関するお詫びとお知らせ,akibasan-pool.jp
