title,attack_type,attack_type_code,description,year,month,day,Africa,Asia,Australia,Europe,North America,South America,reference_title,reference_url
Cyber attack on a municipality in Germany,Hacking,3,"Hülben, Baden-Württemberg, Germany (Landkreis Reutlingen)",2023,6,14,0,0,0,1,0,0,FAQ Cybersicherheitsvorfall,huelben.de
DDoS attack on a business software in Switzerland,Ddos,2,"Bexio - Rapperswil, Canton of St. Gallen, Switzerland",2023,6,13,0,0,0,1,0,0,bexio teilweise nicht verfügbar!,bexio-status.com
DDoS attacks on Icelandic websites,Ddos,2,Iceland,2023,6,13,0,0,0,1,0,0,Islande : des cyberattaques visent des sites officiels et des entreprises technologiques,euractiv.fr
DDoS attack on the website of a port in the Netherlands,Ddos,2,"Port of Amsterdam - Amsterdam, Netherlands",2023,6,13,0,0,0,1,0,0,Pro-Russische groep legt websites Nederlandse havens plat,rtlnieuws.nl
DDoS attack on the website of a port in the Netherlands,Ddos,2,"Port of Den Helder - Den Helder, Noord-Holland, Netherlands",2023,6,13,0,0,0,1,0,0,Pro-Russische groep legt websites Nederlandse havens plat,rtlnieuws.nl
DDoS attack on the website of a port in the Netherlands,Ddos,2,"Port of Rotterdam - Rotterdam, Zuid-Holland, Netherlands",2023,6,13,0,0,0,1,0,0,Pro-Russische groep legt websites Nederlandse havens plat,rtlnieuws.nl
"Cyber attack on a manufacturer of boats and marine propulsion in Illinois, USA",Hacking,3,"Brunswick Corporation - Mettawa, Illinois, USA (Lake County)",2023,6,13,0,0,0,0,1,0,Brunswick Corporation Operations Update,brunswick.com
"Cyber attack on a school district in Texas, USA",Hacking,3,"Lumberton Independent School District - Lumberton, Texas, USA (Hardin County)",2023,6,12,0,0,0,0,1,0,"Lumberton ISD investigates cybersecurity incident, speaks on protecting privacy of students and staff",kfdm.com
Ransomware at a business aircraft operator in Switzerland,Ransomware,6,"TAG Aviation - Geneva, Canton of Geneva, Switzerland",2023,6,1,0,0,0,1,0,0,Hackerangriff auf bekanntes Schweizer Aviatik-Unternehmen wirft Fragen auf,watson.ch
DDoS attack on the federal administration in Switzerland,Ddos,2,"Bern, Canton of Bern, Switzerland",2023,6,12,0,0,0,1,0,0,Russische Hacktivisten attackieren Bundesbern – das steckt dahinter,watson.ch
DDoS attack on a railway company in Switzerland,Ddos,2,"Schweizerische Bundesbahnen (SBB) - Bern, Canton of Bern, Switzerland",2023,6,12,0,0,0,1,0,0,Diverse Webseiten lahmgelegt – auch SBB betroffen,tagesanzeiger.ch
"Unauthorized access at a health care provider in Texas, USA",Hacking,3,"El Centro del Barrio / CentroMed - San Antonio, Texas, USA (Bexar County)",2023,6,12,0,0,0,0,1,0,Notice of a Data Security Incident,centromedsa.com
"Cyber attack on a school board in California, USA",Hacking,3,"San Luis Obispo County Office of Education - San Luis Obispo, California, USA (San Luis Obispo County)",2023,6,12,0,0,0,0,1,0,Hackers target San Luis Obispo County educators,calcoastnews.com
Cyberattack on a medical review service in Germany,Cyber incident,0,"Medizinischer Dienst Niedersachsen - Hannover, Lower Saxony, Germany",2023,6,1,0,0,0,1,0,0,Der MD Niedersachsen ist Ziel eines Angriffs auf seine IT-Systeme geworden.,md-niedersachsen.de
Medical review service in Germany affected by cyber attack,Hacking,3,"Medizinischer Dienst Bremen - Bremen, Germany",2023,6,1,0,0,0,1,0,0,IT-Sicherheitsvorfall in der Verwaltungsgemeinschaft mit dem MD Niedersachsen,md-bremen.org
Spanish students hack accounts of their school,Unknown,7,"Colegio Madre Alberta - Palma, Balearic Islands, Mallorca, Spain",2023,1,1,0,0,0,1,0,0,El colegio Madre Alberta confirma que fue un profesor quien detectó el hakeo de sus ordenadores,ultimahora.es
"Cyber attack on a university in Texas, USA",Hacking,3,"Stephen F. Austin State University (SFA) - Nacogdoches, Texas, USA (Nacogdoches County)",2023,6,11,0,0,0,0,1,0,SFA network hit by cyberattack,dailysentinel.com
Cyber attack on a investment company in Australia,Hacking,3,FIIG Securities - Australia,2023,6,1,0,0,1,0,0,0,FIIG Securities Response to Cyber Incident,fiig.com.au
DDoS attack on the website of a port in the Netherlands,Ddos,2,"Groningen Seaports - Groningen, Groningen, Netherlands",2023,6,1,0,0,0,1,0,0,Pro-Russische groep legt websites Nederlandse havens plat,rtlnieuws.nl
Cyber attack on a payment provider in New Zealand,Hacking,3,"SmartPay / Eftpos - Auckland, New Zealand",2023,6,10,0,0,1,0,0,0,Market wrap: Cyber attack hits eftpos operator SmartPay,stuff.co.nz
Cyberattack on a U.S. alloy manufacturer,Cyber incident,0,"Haynes International - Kokomo, Indiana, USA (Howard County)",2023,6,10,0,0,0,0,1,0,Form 8-K,haynesintl.com
Cyber attack on a university of applied sciences in Germany,Hacking,3,"Hochschule Kaiserslautern - Kaiserslautern, Rhineland-Palatinate, Germany (Kaiserslautern district)",2023,6,9,0,0,0,1,0,0,University of Applied Sciences Kaiserslautern is offline,hs-kl.de
Cyber attack on a sports association in Canada,Hacking,3,"Tennis Canada - Toronto, Ontario, Canada",2023,6,8,0,0,0,0,1,0,Tennis Canada victime d'une fuite de données sur le «Dark Web»,tvanouvelles.ca
Cyber attack on a sports association in France,Hacking,3,"Fédération Française de Rugby - Marcoussis, Île-de-France, France",2023,6,8,0,0,0,1,0,0,La Fédération française de rugby victime d'une cyberattaque,francetvinfo.fr
Cyber attack on a telecommunications provider in Russia,Hacking,3,Infotel JSC - Russia,2023,6,8,0,0,0,1,0,0,Ukrainian hackers take down service provider for Russian banks,bleepingcomputer.com
Cyber attack on a city government in Arkansas,Hacking,3,"City of Fayetteville - Fayetteville, Arkansas, USA (Washington County)",2023,6,8,0,0,0,0,1,0,Network services are offline,fayetteville-ar.gov
Cyber attack on the securities commission in Argentina,Hacking,3,"Comisión Nacional de Valores (CNV) - Buenos Aires, Argentina",2023,6,7,0,0,0,0,0,1,La CNV aisló y controló un ataque informático,argentina.gob.ar
Websites of a building materials supplier in Australia/New Zealand affected by cyber attack,Hacking,3,"Master Builders - Sydney, New South Wales, Australia",2023,6,1,0,0,1,0,0,0,Master Builders: Cybersecurity incident being investigated,nzherald.co.nz
Unauthorized access to email at a city government in Canada,Phishing,5,"City of Richmond - Richmond, British Columbia, Canada",2023,6,7,0,0,0,0,1,0,Cybersecurity Update,richmond.ca
DDoS attack on the website of the Swiss parliament,Ddos,2,"Bern, Canton of Bern, Switzerland",2023,6,7,0,0,0,1,0,0,Website des Parlaments fällt Cyberangriff zum Opfer,netzwoche.ch
Cyber attack on a university in France,Hacking,3,"Aix-Marseille Université - Marseille, Provence-Alpes-Côte d’Azur, France",2023,6,7,0,0,0,1,0,0,L'université d'Aix-Marseille visée par une cyberattaque : plus d'accès au site web ni à Internet,france3-regions.francetvinfo.fr
Cyber attack on a retail chain in Italy,Hacking,3,"Bennet - Montano Lucino, Lombardy, Italy",2023,6,1,0,0,0,1,0,0,Comunicato Stampa,bennet-cdn.thron.com
Cyber attack on a regional promotion association in Switzerland,Hacking,3,"Vaud Promotion - Pully, Canton of Vaud, Switzerland",2023,6,6,0,0,0,1,0,0,Vaud Promotion victime d’une attaque informatique,vaud-promotion.ch
DDoS attack on the website of a Danish computer security incident response team,Ddos,2,"DKCERT - Lyngby, Denmark",2023,6,6,0,0,0,1,0,0,DDoS-angreb mod cert.dk,cert.dk
Ransomware at an it company in Japan,Ransomware,6,"Central Information Systems Co. / 株式会社シーアイエス - Nagoya / 名古屋市, Chūbu / 中部地方, Japan",2023,6,6,0,1,0,0,0,0,当社サーバーへの不正アクセスに関するお知らせ,cisjp.com
Unauthorized access at a medical equipment supplier in Japan,Hacking,3,"Kamijo / 株式会社 上條器械店 - Matsumoto / 松本市, Chūbu / 中部地方, Japan",2023,6,6,0,1,0,0,0,0,弊社サーバーへの不正アクセスについて,kjm.co.jp
Cyber attack on a university in the United Kingdom,Hacking,3,"The University of Manchester - Manchester, England, United Kingdom",2023,6,6,0,0,0,1,0,0,Cyber incident at The University of Manchester,manchester.ac.uk
Cyber attack on a township in New Jersey,Hacking,3,"Montclair Township - Montclair, New Jersey, USA (Essex County)",2023,6,1,0,0,0,0,1,0,Cyber Incident Hits Township Computer Systems,montclairnjusa.org
Cyber attack on a city government in Switzerland,Hacking,3,"Commune de Bex - Bex, Canton of Vaud, Switzerland",2023,6,5,0,0,0,1,0,0,Cyberattaque contre la Commune de Bex,bex.ch
Cyber attack at a developer of solar parks in Germany,Hacking,3,"hep global GmbH - Güglingen, Baden-Württemberg, Germany (Landkreis Heilbronn)",2023,6,1,0,0,0,1,0,0,Stellungnahme des Managements zu einem Cyberangriff,hep.global
Cyber attack on a medical institute in India?,Hacking,3,"All India Institute of Medical Services (AIIMS) - New Delhi, India",2023,6,5,0,1,0,0,0,0,AIIMS Delhi hit by fresh cyberattack for second time in a year,livemint.com
Cyber attack on a library in the Netherlands,Hacking,3,"De Bibliotheek Gouda - Gouda, Zuid-Holland, Netherlands",2023,6,1,0,0,0,1,0,0,Veelgestelde vragen over het cyberincident,bibliotheekgouda.nl
Ransomware at a manufacturer of traffic guidance technology in Belgium,Ransomware,6,"Automatic Systems - Wavre, Wallonia, Belgium",2023,6,3,0,0,0,1,0,0,IT intrusion in Belgium servers,automatic-systems.com
Ransomware at a pharmaceutical company in Japan,Ransomware,6,"Eisai Co., Ltd. / エーザイ株式会社 - Tokyo, Japan",2023,6,3,0,1,0,0,0,0,Notification of Ransomware Incident,eisai.com
Cyber attack on a leasing company in Germany,Hacking,3,"Deutsche Leasing - Bad Homburg vor der Höhe, Hesse, Germany (Hochtaunuskreis)",2023,6,3,0,0,0,1,0,0,Deutsche Leasing is currently affected by a cyber attack on the company's IT systems,deutsche-leasing.com
Receivables management company in Germany affected by cyberattack,Cyber incident,0,"Bad Homburger Inkasso - Bad Homburg vor der Höhe, Hesse, Germany (Hochtaunuskreis)",2023,6,3,0,0,0,1,0,0,ie BHI/BHS ist aktuell von einem Cyberangriff auf die IT-Systeme des Unternehmens betroffen,bad-homburger-inkasso.com
Financial service provider in Australia affected by cyber attack,Hacking,3,"Perpetual - Sydney, New South Wales, Australia",2023,6,1,0,0,1,0,0,0,Interim transacting process,perpetual.com.au
Ransomware at a bank in Spain,Ransomware,6,"Globalcaja - Albacete, Castilla-La Mancha, Spain",2023,6,1,0,0,0,1,0,0,COMUNICADO OFICIAL,twitter.com
Cyber attack on a logistics company in Brazil,Hacking,3,"Tegma Gestão Logística - São Bernardo do Campo, São Paulo, Brazil",2023,5,1,0,0,0,0,0,1,Tegma (TGMA3) Sofre Ataque Cibernético,comoinvestir.thecap.com.br
Cyber attack on a implant manufacturer in Switzerland,Hacking,3,"Medartis - Basel, Canton of Basel-Stadt, Switzerland",2023,5,1,0,0,0,1,0,0,Medartis mit 16% internem Wachstum nach 6 Monaten auf Kurs,medartis.com
Attack on the website of a city government in Thuringia,Cyber incident,0,"Kaltennordheim, Verwaltungsgemeinschaft Hohe Rhön - Kaltennordheim, Thuringia, Germany",2023,5,1,0,0,0,1,0,0,Rhöner Webseiten gehackt,insuedthueringen.de
Information screens of a newspaper affected by hacker attack on data center,Cyber incident,0,"Hellweger Anzeiger - Unna, North Rhine-Westphalia, Germany (Kreis Unna)",2023,5,1,0,0,0,1,0,0,Nach Hackerangriff Nachrichtenbildschirme lassen sich nicht aktualisieren,hellwegeranzeiger.de
DDoS attack on the website of a city government in Slovakia,Ddos,2,"Bratislava, Slovakia",2023,5,31,0,0,0,1,0,0,Bratislava faced massive cyber-attack during GLOBSEC conference,euractiv.com
Cyber attack on a emergency service in the United Kingdom,Hacking,3,"Humberside Fire and Rescue Service - Kingston upon Hull, England, United Kingdom",2023,5,1,0,0,0,1,0,0,Humberside fire service learns about cyber incidents the hard way,emergencyservicestimes.com
Ransomware at a school district in Virginia,Ransomware,6,"Middlesex County Public Schools - Saluda, Virginia, USA (Middlesex County0)",2023,5,31,0,0,0,0,1,0,Superintendent confirms Virginia school system hit with ransomware attack: Daily operations impact 'minimal',wtvr.com
Unauthorized access to mails of the U.S. Department of Commerce,Hacking,3,"U.S. Department of Commerce - Washington, D.C., USA",2023,1,1,0,0,0,0,1,0,"Chinese hackers breached State, Commerce Depts, Microsoft and US say",reuters.com
Unauthorized access to mails of the U.S. State Department,Hacking,3,"U.S. State Department - Washington, D.C., USA",2023,1,1,0,0,0,0,1,0,https://www.reuters.com/world/us/chinese-hackers-stole-60000-emails-us-state-department-microsoft-hack-senate-2023-09-27/,reuters.com
Bank from Austria affected by cyber attack,Hacking,3,"Bank99 - Vienna, Austria",2023,5,31,0,0,0,1,0,0,Hackerangriff auf Dienstleister: Datenleck auch bei der Bank99,kurier.at
Cyberattack on the Financial Market Authority in Austria,Cyber incident,0,"Finanzmarktaufsichtsbehörde FMA - Vienna, Austria",2023,5,31,0,0,0,1,0,0,"Finanzmarktaufsichtsbehörde FMA von „MOVEit“-Hacker-Angriff betroffen. Sehr heterogene Datensätze gestohlen, datenschutzrechtliche Relevanz begrenzt.",fma.gv.at
Auditing company in Australia affected by cyber attack,Hacking,3,"PwC Australia - Sydney, New South Wales, Australia",2023,5,31,0,0,1,0,0,0,Embattled consulting firm PwC swept up in global cyber breach,afr.com
Facility management company in Australia affected by cyber attack,Hacking,3,"? - Melbourne, Victoria, Australia",2023,5,31,0,0,1,0,0,0,"Medibank’s building manager faces cyberattack, staff details stolen",wsau.com
Australian gaming technology provider hit by cyberattack,Cyber incident,0,"Aristocrat - North Ryde, New South Wales, Australia",2023,5,31,0,0,1,0,0,0,Statement on Cyber Incident,ir.aristocrat.com
Mining company in Australia affected by cyber attack,Hacking,3,"Fortescue - Perth, Western Australia, Australia",2023,5,31,0,0,1,0,0,0,Fortescue Hit by Cyber Attack That Saw Network Data Disclosed,finance.yahoo.com
Unauthorized access at the European subsidiary of a Japanese automotive supplier,Hacking,3,"Toyota Boshoku Europe - Zaventem, Flemish Region, Belgium",2023,5,31,0,0,0,1,0,0,子会社への不正アクセスについて,toyota-boshoku.com
Company in Bermuda affected by cyber attack,Hacking,3,Enstar - Bermuda,2023,5,31,0,0,0,0,1,0,Data Breach Notification,apps.web.maine.gov
Administrative entity in Canada affected by cyber attack,Hacking,3,"Region of Queens Municipality - Liverpool, Nova Scotia, Canada",2023,5,31,0,0,0,0,1,0,Region of Queens Municipality Impacted by Province of Nova Scotia’s Cybersecurity Breach,regionofqueens.com
Engineering Group from Canada affected by cyber attack,Hacking,3,"WSP - Montreal, Québec, Canada",2023,5,31,0,0,0,0,1,0,250 000 travailleurs de la construction victimes d’une fuite de données,lapresse.ca
Social service in Canada affected by cyber attack,Hacking,3,"Department of Community Services - Halifax, Nova Scotia, Canada",2023,5,31,0,0,0,0,1,0,Update on MOVEit Data Breach,novascotia.ca
Canadian province's education department hit by cyberattack,Cyber incident,0,"Department of Education and Early Childhood Development - Halifax, Nova Scotia, Canada",2023,5,31,0,0,0,0,1,0,Significant Progress Made in Cybersecurity Breach Investigation,novascotia.ca
Correctional Services in Canada affected by cyber attack,Hacking,3,"Department of Justice - Correctional Services - Halifax, Nova Scotia, Canada",2023,5,31,0,0,0,0,1,0,Update on MOVEit Data Breach,novascotia.ca
Department of a Canadian province affected by cyberattack,Cyber incident,0,"Department of Labour, Skills and Immigration - Halifax, Nova Scotia, Canada",2023,5,31,0,0,0,0,1,0,Significant Progress Made in Cybersecurity Breach Investigation,novascotia.ca
Election Authority in Canada affected by cyber attack,Hacking,3,"Elections Nova Scotia - Dartmouth, Nova Scotia, Canada",2023,5,31,0,0,0,0,1,0,Significant Progress Made in Cybersecurity Breach Investigation,novascotia.ca
City government in Canada affected by cyber attack,Hacking,3,"Halifax Regional Municipality - Halifax, Nova Scotia, Canada",2023,5,31,0,0,0,0,1,0,Update on MOVEit Data Breach,novascotia.ca
Health Department in Canada affected by cyber attack,Hacking,3,"Nova Scotia Health Authority - Halifax, Nova Scotia, Canada",2023,5,31,0,0,0,0,1,0,Update on MOVEit Data Breach,novascotia.ca
Canadian not-for-profit health insurer affected by cyber attack,Hacking,3,"Green Shield Canada (GSC) - Windsor, Ontario, Canada",2023,5,31,0,0,0,0,1,0,Update on MOVEit Data Breach,greenshield.ca
Canadian children's health advocacy organization affected by cyberattack,Cyber incident,0,"BORN Ontario - Ottawa, Ontario, Canada",2023,5,31,0,0,0,0,1,0,Cybersecurity Incident - MOVEit,bornontario.ca
Hospital in Canada affected by cyber attack,Hacking,3,"IWK Health Centre - Halifax, Nova Scotia, Canada",2023,5,31,0,0,0,0,1,0,Province identifies more groups Impacted by MOVEit breach,ckbw.ca
Canadian drug prescription monitoring program hit by cyberattack,Cyber incident,0,"Nova Scotia Prescription Monitoring Program (NSPMP) - Halifax, Nova Scotia, Canada",2023,5,31,0,0,0,0,1,0,Significant Progress Made in Cybersecurity Breach Investigation,novascotia.ca
Law firm in Canada affected by cyber attack,Hacking,3,"EY Law - Toronto, Ontario, Canada",2023,5,31,0,0,0,0,1,0,Data Breach Notification,apps.web.maine.gov
Canadian mining company affected by cyber attack,Hacking,3,"Barrick - Toronto, Ontario, Canada",2023,5,31,0,0,0,0,1,0,Canadian-based gold miner among the latest MOVEit data breach victims,itbusiness.ca
Pension plan in Canada affected by cyber attack,Hacking,3,"Nova Scotia pension plan - Halifax, Nova Scotia, Canada",2023,5,31,0,0,0,0,1,0,Update on MOVEit Data Breach,novascotia.ca
Police agency in Canada affected by cyber attack,Hacking,3,"Metro Vancouver Transit Police - New Westminster, British Columbia, Canada",2023,5,31,0,0,0,0,1,0,'Security vulnerability': Metro Vancouver Transit Police hit by global cyberattack,dailyhive.com
School board in Canada affected by cyber attack,Hacking,3,"Conseil scolaire acadien provincial (CSAP) - Saulnierville, Nova Scotia, Canada",2023,5,31,0,0,0,0,1,0,Privacy breach alerts and information,novascotia.ca
Tax authority in Canada affected by cyber attack,Hacking,3,"Canada Revenue Agency - Ottawa, Ontario, Canada",2023,5,31,0,0,0,0,1,0,250 000 travailleurs de la construction victimes d’une fuite de données,lapresse.ca
Canadian water utility affected by cyber attack,Hacking,3,"Halifax Water - Halifax, Nova Scotia, Canada",2023,5,31,0,0,0,0,1,0,Province identifies more groups Impacted by MOVEit breach,ckbw.ca
Automotive supplier from Switzerland affected by cyber attack,Hacking,3,"Garrett Motion - Rolle, Canton of Vaud, Switzerland",2023,5,31,0,0,0,1,0,0,Form 8-K,sec.gov
Company from Switzerland affected by cyber attack?,Hacking,3,? - Switzerland,2023,5,31,0,0,0,1,0,0,Clop attackiert grossen Schweizer Baukonzern – USA setzen 10 Millionen Dollar Kopfgeld aus,watson.ch
Health insurer in Switzerland affected by cyber attack,Hacking,3,"ÖKK Kranken- und Unfallversicherungen AG (ÖKK) - Landquart, Canton of the Grisons, Switzerland",2023,5,31,0,0,0,1,0,0,Schweizer Krankenkasse und Ferien-Anbieterin bestätigen Datenklau durch russische Bande,watson.ch
Tobacco manufacturer affected by cyber attack,Hacking,3,"Japan Tobacco International - Geneva, Canton of Geneva, Switzerland",2023,5,31,0,0,0,1,0,0,Tabakriese JTI bestätigt: 'Auch wir gehören zu Moveit-Opfern',inside-it.ch
Association of statutory health insurers in Germany affected by cyber attack,Hacking,3,"AOK Bundesverband - Berlin, Germany",2023,5,31,0,0,0,1,0,0,Mehrere AOKs von Sicherheitslücke in Software zur Datenübertragung betroffen,aok.de
Bank from Germany affected by cyber attack,Hacking,3,"Commerzbank / Comdirect - Frankfurt/Main, Hesse, Germany",2023,5,31,0,0,0,1,0,0,Datenleck trifft auch Kunden der Direktbanken ING und Comdirect,handelsblatt.com
Bank from Germany affected by cyber attack,Hacking,3,"Deutsche Bank - Frankfurt/Main, Hesse, Germany",2023,5,31,0,0,0,1,0,0,Deutsche Bank meldet Datenleck,handelsblatt.com
Bank in Germany affected by cyber attack,Hacking,3,"GLS-Bank - Bochum, North Rhine-Westphalia, Germany",2023,5,31,0,0,0,1,0,0,Kontowechsel-Datenleck: Mehr als 144.000 Datensätze gestohlen – diese Banken sind am stärksten betroffen,handelsblatt.com
Bank in Germany affected by cyber attack,Hacking,3,"Norisbank - Bonn, North Rhine-Westphalia, Germany",2023,5,31,0,0,0,1,0,0,Kontowechsel-Datenleck: Mehr als 144.000 Datensätze gestohlen – diese Banken sind am stärksten betroffen,handelsblatt.com
Bank in Germany affected by cyber attack,Hacking,3,"Oldenburgische Landesbank - Oldenburg (Oldb), Lower Saxony, Germany",2023,5,31,0,0,0,1,0,0,Kontowechsel-Datenleck: Mehr als 144.000 Datensätze gestohlen – diese Banken sind am stärksten betroffen,handelsblatt.com
Bank from Germany affected by cyber attack,Hacking,3,"Postbank - Bonn, North Rhine-Westphalia, Germany",2023,5,31,0,0,0,1,0,0,Deutsche Bank meldet Datenleck,handelsblatt.com
Banking group from Germany affected by cyber attack,Hacking,3,Sparda-Banken - Germany,2023,5,31,0,0,0,1,0,0,Bafin warnt nach Cyberangriff vor Risiko durch externe Dienstleister,handelsblatt.com
German comparison shopping website affected by cyber attack,Hacking,3,"Verivox - Heidelberg, Baden-Württemberg, Germany",2023,5,31,0,0,0,1,0,0,"Ausführliche Kundeninformation:
Datenschutzinformation gemäß Art. 34 DSGVO (Stand 16.06.2023)",verivox.de
Energy technology company from Germany affected by cyber attack,Hacking,3,"Siemens Energy - Munich, Bavaria, Germany",2023,5,31,0,0,0,1,0,0,Siemens Energy: no critical data was compromised after MOVEit data breach,reuters.com
Insurance company from Germany affected by cyber attack,Hacking,3,"Bayern-Versicherung Lebensversicherung AG - Munich, Bavaria, Germany",2023,5,31,0,0,0,1,0,0,Weltweiter Cyber­angriff auf IT-Dienst­leister,konzern-versicherungskammer.de
Insurance company from Germany affected by cyber attack,Hacking,3,"Provinzial / Provinzial Nordwest Lebensversicherung AG - Düsseldorf, North Rhine-Westphalia, Germany",2023,5,31,0,0,0,1,0,0,Datenleck mit weltweiter Wirkung,rp-online.de
Insurance company from Germany affected by cyber attack,Hacking,3,"Provinzial / RheinLand Versicherungs AG - Neuss, North Rhine-Westphalia, Germany (Rhein-Kreis Neuss)",2023,5,31,0,0,0,1,0,0,IT-Dienstleister der Provinzial von Hackangriff betroffen,provinzial-konzern.de
Media company in Germany affected by cyber attack,Hacking,3,"VRM - Mainz, Rhineland-Palatinate, Germany",2023,5,31,0,0,0,1,0,0,Cyberangriff: Kundendaten betroffen,vrm.de
Manufacturer of printing presses from Germany affected by cyber attack,Hacking,3,"Heidelberger Druckmaschinen AG - Heidelberg, Baden-Württemberg, Germany",2023,5,31,0,0,0,1,0,0,HEIDELBERG Statement on the security vulnerability of the MOVEit software,heidelberg.com
Cyber attack on a publishing company in Germany,Hacking,3,"Verlagsgesellschaft Vogelsberg GmbH & Co. KG - Alsfeld, Hesse, Germany (Vogelsbergkreis)",2023,5,31,0,0,0,1,0,0,Cyberangriff bei IT-Dienstleister: Kunden-Daten betroffen,mittelhessen.de
Service provider for customer contact management from Germany affected by cyber attack,Hacking,3,"Majorel Deutschland - Gütersloh, Nordrhein-Westfalen, Germany (Kreis Gütersloh)",2023,5,31,0,0,0,1,0,0,Datenleck trifft auch Kunden der Direktbanken ING und Comdirect,handelsblatt.com
"Statutory health insurance in Baden-Württemberg, Germany affected by cyber attack",Hacking,3,"AOK Baden-Württemberg - Stuttgart, Baden-Württemberg, Germany",2023,5,31,0,0,0,1,0,0,Mehrere AOKs von Sicherheitslücke in Software zur Datenübertragung betroffen,aok.de
"Statutory health insurance in Bavaria, Germany affected by cyber attack",Hacking,3,"AOK Bayern - Munich, Bavaria, Germany",2023,5,31,0,0,0,1,0,0,Mehrere AOKs von Sicherheitslücke in Software zur Datenübertragung betroffen,aok.de
"Statutory health insurance in Bremen, Germany affected by cyber attack",Hacking,3,"AOK Bremen/Bremerhaven - Bremen, Germany",2023,5,31,0,0,0,1,0,0,Mehrere AOKs von Sicherheitslücke in Software zur Datenübertragung betroffen,aok.de
"Statutory health insurance in Hesse, Germany affected by cyber attack",Hacking,3,"AOK Hessen - Bad Homburg vor der Höhe, Hesse, Germany (Hochtaunuskreis)",2023,5,31,0,0,0,1,0,0,Mehrere AOKs von Sicherheitslücke in Software zur Datenübertragung betroffen,aok.de
"Statutory health insurance in Lower Saxony, Germany affected by cyber attack",Hacking,3,"AOK Niedersachsen - Hannover, Lower Saxony, Germany",2023,5,31,0,0,0,1,0,0,Mehrere AOKs von Sicherheitslücke in Software zur Datenübertragung betroffen,aok.de
"Statutory health insurance in Saxony, Germany affected by cyber attack",Hacking,3,"AOK Plus - Dresden, Saxony, Germany",2023,5,31,0,0,0,1,0,0,Mehrere AOKs von Sicherheitslücke in Software zur Datenübertragung betroffen,aok.de
"Statutory health insurance in Rhineland-Palatinate, Germany affected by cyber attack",Hacking,3,"AOK Rheinland-Pfalz/Saarland - Eisenberg (Pfalz), Rhineland-Palatinate, Germany (Donnersbergkreis)",2023,5,31,0,0,0,1,0,0,Mehrere AOKs von Sicherheitslücke in Software zur Datenübertragung betroffen,aok.de
"Statutory health insurance in Sachsen-Anhalt, Germany affected by cyber attack",Hacking,3,"AOK Sachsen-Anhalt - Magdeburg, Sachsen-Anhalt, Germany",2023,5,31,0,0,0,1,0,0,Mehrere AOKs von Sicherheitslücke in Software zur Datenübertragung betroffen,aok.de
Mechanical engineering company from Denmark affected by cyber attack,Hacking,3,"DESMI A/S - Nørresundby, Denmark",2023,5,31,0,0,0,1,0,0,Information regarding cyberattack incident,desmi.com
Technology company from Finland affected by cyber attack?,Hacking,3,"Valmet - Espoo, Finland",2023,5,31,0,0,0,1,0,0,Venäläisjengi retosteli tieto­murrolla Valmetiin – näin yhtiö kommentoi,is.fi
