id,day,month,year,source_database,source_database_encoded,attack_description,industry_type,industry_type_group,industry_type_group_encoded,subcategory,subcategory_group,subcategory_group_encoded,attack_details,ti_safe_score,impact,link_at_the_internet,Africa,Asia,Australia,Europe,North America,South America
1070,10,8,2022,TI Safe,4,7-Eleven Denmark confirms ransomware attack behind store closures,Communication and telecommunications,Technology,10,Commercial Facilities,Commercial and public,5,"7-Eleven Denmark suffered a ransomware attack was behind the closure of 175 stores in the country. The company did not provide any information about the gang responsible, other than confirming that the threat actors breached its network and encrypted syst",4.0,The attack took place preventing 7-Eleven stores in Denmark from using their cash registers or accepting payments. This caused all 7-Eleven stores across the country to be closed while the company investigated the incident.,bleepingcomputer.com,0,0,0,1,0,0
1069,8,8,2022,TI Safe,4,Twilio discloses data breach after SMS phishing attack on employees,Information Technology,Technology,10,Information Technology,Technology,24,Cloud communications company Twilio says some of its customers' data was accessed by attackers who breached internal systems after stealing employee credentials in an SMS phishing attack.,4.0,"
Attackers used the stolen credentials to gain access to some internal systems where they were able to access certain customer data",bleepingcomputer.com,0,0,0,0,1,0
1068,8,8,2022,TI Safe,4,"National Agency of Petroleum, Natural Gas and Biofuels suffered an attempted cyber attack.",Chemical and Farmaceutic industry,Chemical Industry,2,Oil and Gas,Oil and Gas,20,"National Agency of Petroleum, Natural Gas and Biofuels suffered an attempted cyber attack last week. In a statement, the agency stressed that, as a security measure, all systems were taken offline to assess cybersecurity risks.",4.0,"As a result, the systems are temporarily unavailable to users.",securityreport.com.br,0,0,0,0,0,1
1067,4,8,2022,TI Safe,4,TSMC says possible Taiwan invasion could bring global chip production to a halt,Information Technology,Technology,10,Information Technology,Technology,24,"Rising tensions between the United States and China over the fate of Taiwan could jeopardize global chip production. According to TSMC, a possible invasion of the island could result in the total stoppage of its production, as it would not be willing to w",4.0,A possible invasion of the island could result in the total stoppage of its production,adrenaline.com.br,0,1,0,0,0,0
1066,1,8,2022,TI Safe,4,BlackCat ransomware claims attack on European gas pipeline,Chemical and Farmaceutic industry,Chemical Industry,2,Oil and Gas,Oil and Gas,20,"The ALPHV ransomware gang, aka BlackCat, claimed responsibility for a cyberattack against Creos Luxembourg S.A. last week, a natural gas pipeline and electricity network operator in the central European country.",4.0,"180,000 files were stolen totaling 150 GB in size, including contracts, agreements, passports, accounts and emails. ALPHV/BlackCat has launched a new extortion platform where they make stolen data searchable by visitors, with the aim of increasing pressur",bleepingcomputer.com,0,0,0,1,0,0
1065,31,7,2022,TI Safe,4,TJDFT website goes down after Court detects “malicious activity”,Government,Public,9,Government Facilities,Government,14,"The website of the Court of Justice of the Federal District and Territories (TJDFT) was offline. According to the Court, “malicious activity” was detected during the night and the email address was taken down as a precaution.",4.0,"As a precaution, the site and other systems were shut down so that repair and investigation activities can be carried out.",metropoles.com,0,0,0,0,0,1
1064,29,7,2022,TI Safe,4,Lockbit ransomware group claims to have stolen 78GB of files from the Italian Federal Revenue,Government,Public,9,Government Facilities,Government,14,The Lockbit ransomware gang claims to have hacked the Italian Revenue Agency (Agenzia delle Entrate) and added the government agency to the list of victims reported on its deep web leak site.,4.0,"The group claims to have stolen 78GB of data, including company documents, scans, financial reports and contracts, and plans to release screenshots of files and samples very soon.",boletimsec.com.br,0,0,0,1,0,0
1063,19,7,2022,TI Safe,4,Building materials giant Knauf hit by Black Basta ransomware gang,Manufacturing and automation,Manufacturing,8,Critical Manufacturing,Steel and mining,23,"The Knauf Group has announced it has been the target of a cyberattack that has disrupted its business operations, forcing its global IT team to shut down all IT systems to isolate the incident.",4.0,"They are working hard to mitigate the impact to customers and partners as well as to plan for a safe recovery. However, they apologize for any inconvenience or delay in delivery processes that may occur.sss",bleepingcomputer.com,0,0,0,1,0,0
1062,14,7,2022,TI Safe,4,Pakistani air force is victim of cyber attack,Sector and Production,Manufacturing,8,Aerospace,Aerospace,1,"CPR found evidence linking the files to the APT SideWinder group, known to target Pakistani entities and suspected to be based in India.",3.0,"One of the files decrypted by CPR was produced by InfoStealer-type malware used exclusively by this group, and contained a list of all relevant files extracted from the infected computer.",securityreport.com.br,0,1,0,0,0,0
1061,14,7,2022,TI Safe,4,"After incident and rescue required, Municipality of Itapemirim announces restoration of the system",Government,Public,9,Government Facilities,Government,14,"The Municipality of Itapemirim, in the state of Espírito Santo, announced that it was the victim of a cyber attack on its digital process system. According to information, the cybercriminals responsible for the action left a message demanding a ransom req",4.0,"Digital process system was suspended, it was only released after
the rescue. Due to the incident, some other systems were also damaged.",securityreport.com.br,0,0,0,0,0,1
1060,12,6,2022,TI Safe,4,Utility/DOE data indicates sophisticated hackers have compromised US electric control centers,Energy,Energy,4,Energy,Energy,10,"Taken from unclassified OE-417 NERC Lessons Learned forms, hundreds of actual cyber incidents of the power grid control system are not being reported. This includes the six cyber network-related outages where power was lost to hundreds of thousands or eve",5.0,This results in Loss of monitoring or control.,controlglobal.com,0,0,0,0,1,0
1059,11,7,2022,TI Safe,4,Semae suffers cyber attack and services are impacted,Water and wastewater sector and,Infrastructure,7,Water and Wastewater Systems,Critical Infrastructure,7,"Semae (Municipal Water and Sewage Service) in São Leopoldo (RS) reported that it suffered a cyber attack in the last week, resulting in the interruption of the systems",5.0,"It resulted in the interruption of the systems, in addition to impacting services, such as exchange of ownership, access to enrollment, request for social tariff and local inspection, which are being gradually restored after the event. Data was corrupted ",securityreport.com.br,0,0,0,0,0,1
1058,22,6,2022,TI Safe,4,Corruption At Gazprom Facilitated GUR Hackers' Attack On The Urengoy Gas Pipeline,Chemical and Farmaceutic industry,Chemical Industry,2,Oil and Gas,Oil and Gas,20,A key section of the data communications network of the gas pipeline that would transmit an alarm when the pipeline was operating outside of acceptable conditions was never connected by the contractor hired by Gazprom to install the system according to do,4.0,The data needed to plan and implement an attack was available to GUR hackers.,jeffreycarr.substack.com,0,1,0,0,0,0
1057,25,6,2022,TI Safe,4,Automotive fabric supplier TB Kawashima announces cyberattack,Sector and Production,Manufacturing,8,Automotive,Transport,25,"TB Kawashima announced that one of its subsidiaries, a Thai sales company, had been breached, prompting immediate action to shut down the devices the attacker was accessing.",4.0,"Toyota Boshoku Group's production and sales activities were not impacted and all operations are operating within normal parameters. However, the company's website is currently down.",bleepingcomputer.com,0,0,0,0,1,0
1056,23,6,2022,TI Safe,4,Lithuania warns of rise in DDoS attacks against government sites,Government,Public,9,Government Facilities,Government,14,"Due to these cyber attacks, transport agencies, financial institutions and other major entities in Lithuania have experienced temporary service interruptions.",4.0,"There are no reports of serious problems or high-impact outages from the country, but some services such as Lithuanian Railways are experiencing issues with ticketing and communicating with customers.",bleepingcomputer.com,0,0,0,1,0,0
1055,21,6,2022,TI Safe,4,Yodel parcel company confirms cyberattack is disrupting delivery,Transport sector and,Transport,11,Transportation Systems,Transport,25,Services for the U.K.-based Yodel delivery service company have been disrupted due to a cyberattack that caused delays in parcel distribution and tracking orders online.,4.0,"Customers waiting for package delivery, tracking and customer service were left unresponsive, some of them claiming they had not had package information for at least four days. The system was down.",bleepingcomputer.com,0,0,0,1,0,0
1054,20,6,2022,TI Safe,4,Ministry of Economy investigates exposure of Brazilian data,Information Technology,Technology,10,Information Technology,Technology,24,"A cybersecurity company that partners with investigative bodies such as Interpol, a failure in the folder's server exposed data from more than 20,000 Brazilians.",4.0,The information is believed to have been exposed for at least two months and it is not yet known whether the leak was the result of breach or willful action.,securityreport.com.br,0,0,0,0,0,1
1053,8,6,2022,TI Safe,4,Ransomware attack impacts servers of the Municipality of Alegre,Government,Public,9,Government Facilities,Government,14,The Municipality of Alegre suffered a ransomware-type attack on its servers.,4.0,"Much of the data is affected, but there is no data leak. All City Hall services are unavailable indefinitely.",securityreport.com.br,0,0,0,0,0,1
1052,8,6,2022,TI Safe,4,A major Russian radio station was hacked,Government,Public,9,Government Facilities,Government,14,A major Russian radio station was hacked and started broadcasting Ukrainian anthems and anti-war songs on Wednesday.,3.0,Russian radio station was hacked and started broadcasting Ukrainian anthems and anti-war songs,businessinsider.com,0,1,0,0,0,0
1051,7,6,2022,TI Safe,4,Cyber attacks interrupt VISA applications at Irish embassy in Turkey,Sector and Production,Manufacturing,8,Aerospace,Aerospace,1,THE IRISH EMBASSY in Turkey is temporarily unable to process visa applications due to “persistent” cyber attacks,4.0,Cyber ​​attacks disrupted services.,thejournal.ie,0,0,0,1,0,0
1050,6,6,2022,TI Safe,4,Italian city of Palermo shuts down all systems to fend off cyberattack,Information Technology,Technology,10,Information Technology,Technology,24,"The municipality of Palermo in Southern Italy suffered a cyberattack on Friday, which appears to have had a massive impact on a broad range of operations and services to both citizens and visiting tourists.",4.0,"The systems were impacted including the public management of video surveillance, the municipal police operations center and all services of the municipality. Although local IT experts have been trying to restore systems for the past three days, all servic",bleepingcomputer.com,0,0,0,1,0,0
1049,6,6,2022,TI Safe,4,Costa Rican government held up by ransomware,Information Technology,Technology,10,Information Technology,Technology,24,Notorious Russian ransomware gang Conti threatened to overthrow the Costa Rican government if a ransom was not paid.,4.0,"The Costa Rican government said at least 30 of the agency's servers were infected, and its attempt to shut down systems to limit the damage appears to have failed.",theregister.com,0,0,0,0,1,0
1048,3,6,2022,TI Safe,4,Pharmaceutical giant Novartis suffered a cyberattack by the data extortion gang Industrial Spy,Communication and telecommunications,Technology,10,Commercial Facilities,Commercial and public,5,"Pharmaceutical giant Novartis suffered a cyberattack by the data extortion gang Industrial Spy, but reported that no sensitive data was compromised.
",3.0,No sensitive data has been compromised,bleepingcomputer.com,0,0,0,0,0,1
1047,22,5,2022,TI Safe,4,SpiceJet airline passengers stranded after ransomware attack,Transport sector and,Transport,11,Transportation Systems,Transport,25,Indian low-cost airline SpiceJet suffered an attempted ransomware attack that impacted some of its systems and caused flight departure delays.,4.0,Impacted some of its systems and caused delays on flight departures.,bleepingcomputer.com,0,1,0,0,0,0
1046,19,5,2022,TI Safe,4,Zambian central bank refuses to pay ransom to hackers,Banking and finance,Financial,5,Financial services,Financial,13,Zambia’s central bank said it refused to pay ransom to a group known as Hive that was behind a cybersecurity breach that caused minimal damage to its systems.,3.0,All major systems are still working,news24.com,0,0,0,0,1,0
1045,16,5,2022,TI Safe,4,Bradesco suffered a data incident at Bradesco Financiamentos,Banking and finance,Financial,5,Financial services,Financial,13,"Bradesco communicated to the market the correction of a flaw that allowed the visualization of data contained in customer contracts of Bradesco Financiamentos, one of the subsidiaries of the group.",4.0,"The flaw may have allowed the visualization of data from approximately 53,000 customers.",convergenciadigital.com.br,0,0,0,0,0,1
1044,16,5,2022,TI Safe,4,Cyber ​​attack impacts technological infrastructure of the Court of Auditors of Paraná,Information Technology,Technology,10,Information Technology,Technology,24,The Court of Auditors of Paraná reported that it detected suspicious records of malicious activities in its technological infrastructure. Detected as Malware,3.0,"There were no losses, nor were the systems through which municipalities connect to the TCE affected.",securityreport.com.br,0,0,0,0,0,1
1043,11,5,2022,TI Safe,4,Ransomware Attack Closes College Founded in 1865,Education and Research,Public,9,Education and Research,Education and Research,9,"A college founded in 1865 in the city of Lincoln, Illinois, is closing its doors after falling victim to a ransomware attack carried out by Iranian hackers.",4.0,"The cyber-action damage thwarted admissions activities and made it difficult to access all institutional data, and encrypted important data. ",olhardigital.com.br,0,0,0,0,1,0
1042,10,5,2022,TI Safe,4,"
UK government hackers destroyed hundreds of thousands of stolen credit card details held by criminals",Government,Public,9,Government Facilities,Government,14,"Ministry of Defense and GCHQ agents ""set up operations to undermine [criminals'] networks and stop them from profiting from their crimes, as well as denying them access to their cyber tools and malware""",4.0,"No details were given about these operations, they were given as an example of legal and legitimate hacking.",news.sky.com,0,0,0,1,0,0
1041,6,5,2022,TI Safe,4,AGCO Announces Ransomware Attack,Agricultural,Agricultural,0,"Agriculture, food and beverage",Agricultural,2,"AGCO, Your Agriculture Company was the target of a ransomware attack that affected some of its production facilities.",4.0,The ransomware attack that affected some of their production facilities.,news.agcocorp.com,0,0,0,0,1,0
1040,9,5,2022,TI Safe,4,Costa Rica declares national emergency after Conti ransomware attacks,Government,Public,9,Government Facilities,Government,14,The Costa Rican President Rodrigo Chaves has declared a national emergency following cyber attacks from Conti ransomware group on multiple government bodies.,5.0,The group had leaked 97% of the 672GB data dump allegedly containing information stolen from government agencies.,bleepingcomputer.com,0,0,0,0,1,0
1039,3,5,2022,TI Safe,4,RIPTA releases hacker note on ransomware attack,Government,Public,9,Government Facilities,Government,14,The Rhode Island Public Transit Authority released the rescue from a cyber attack in August. RIPTA said that a third-party forensics team determined that hackers accessed certain files stored on the bus agency's computers between August 3 and 5 of last ye,4.0,"Hackers stole the names, birth dates and Social Security numbers of 17,000 current and former employees of the state of Rhode Island.",turnto10.com,0,0,0,0,1,0
1038,26,4,2022,TI Safe,4,French hospital group disconnects internet after hackers steal data,Hospital and health,Health and Homecare,6,Healthcare and Public Health,Healthcare,15,The Hospitals and Health group shut down all inbound and outbound Internet connections after discovering they had suffered a cyberattack that resulted in the theft of confidential patient and administrative data.,5.0,They followed up copying administrative data from computers stored on the establishment's systems and warned that other threat actors could publish and use the data.,bleepingcomputer.com,0,0,0,1,0,0
1037,11,4,2022,TI Safe,4,"SuperCare Health data breach affects over 300,000 people",Hospital and health,Health and Homecare,6,Healthcare and Public Health,Healthcare,15,"SuperCare Health, a California respiratory care provider, recently disclosed a data breach affecting more than 300,000 individuals. SuperCare said the hack was discovered on July 27, 2021, when it noticed unauthorized activity on some systems. An investig",5.0,"The breach exposed files that contained patient information, including name, address, date of birth, hospital or medical group, chart number, patient account number, health-related information, and claim information. In some cases, CPF and driver's licens",securityweek.com,0,0,0,0,1,0
1036,15,4,2022,TI Safe,4,Banco Pan confirms customer data leak,Banking and finance,Financial,5,Financial services,Financial,13,A 'weakness' in a technology vendor's platform allowed customer information to be leaked. Banco Pan says complete card data and passwords were not exposed.,4.0,"The fragility allowed the leakage of customer information allowing, according to the financial institution, unauthorized copying of registration data and available limit and debt balance.",g1.globo.com,0,0,0,0,0,1
1035,27,3,2019,SCIDMARK ,3,Ellsworth County Rural Water District had its water system breached,Water and wastewater sector and,Infrastructure,7,Water and Wastewater Systems,Critical Infrastructure,7,"Wyatt Travnichek knowingly accessed the Ellsworth County Rural Water District's protected computer system without authorization. During this unauthorized access, it is alleged that Mr. Travnichek carried out activities that terminated processes at the fac",4.0,Processes at the facility that affect facility cleaning and disinfection procedures have been terminated,ibtimes.co.uk,0,0,0,0,1,0
1034,24,4,2020,SCIDMARK ,3,Attempted violation of the plant system(s) at the Israeli Water Plant(s),Water and wastewater sector and,Infrastructure,7,Water and Wastewater Systems,Critical Infrastructure,7,"The Israel National Cyber ​​Directorate has received reports of attempts to attack the control and monitoring systems of sewage treatment plants, pumping stations and sewage from one or more water treatment plants.",3.0,The impact was not reported.,ibtimes.co.uk,0,1,0,0,0,0
1033,23,4,2007,SCIDMARK ,3,Operator Error / Configuration Error at the water treatment plant in the City of Spencer,Water and wastewater sector and,Infrastructure,7,Water and Wastewater Systems,Critical Infrastructure,7,"Malfunction at one of the city's water treatment plants, where a dangerous amount of sodium hydroxide (bleach) was released into the city's water supply.",5.0,"The damage appeared to be isolated only to the town of Spencer; however, as there were several residents affected by the contaminated water, several fire districts were contacted to alleviate the large number of residents who needed immediate medical atte",ibtimes.co.uk,0,0,0,0,1,0
1032,5,2,2021,SCIDMARK ,3,Oldsmar city water system has been breached,Water and wastewater sector and,Infrastructure,7,Water and Wastewater Systems,Critical Infrastructure,7,"The attack was carried out via remote access software (TeamViewer) 15 on the computer system of the plant responsible for water clarification for distribution, portable water for the local community of approximately 15,000 inhabitants.",4.0,"Product operational features are not available with an acceptable workaround. Customer implementation or core business production, core applications or mission-critical systems are running with limited resources or partially missing functions.",ibtimes.co.uk,0,0,0,0,1,0
1031,23,1,2021,SCIDMARK ,3,Ransomware Attack Against Commercial and Operating Systems at WestRock Company,Government,Public,9,Government Facilities,Government,14,"Ransomware penetrated the corporate Business Network, perhaps via the Operations Network (speculatively), infecting corporate systems and operational equipment in factories. The method and vector of infection were not disclosed.",3.0,"The damage was mostly contained in the business network. However, some sites reported impacts relevant to their operations networks, which required manual control of the operations performed.",ibtimes.co.uk,0,0,0,1,0,0
1030,22,5,2003,SCIDMARK ,3,Dam Failure False Alarm at Santee Cooper,Energy,Energy,4,Energy,Energy,10,"Non-descriptive computer system has experienced a 'computer crash', accidentally triggering the public alarm/alert notification system to sound.",3.0,Malfunction caused the public alert system to be triggered.,ibtimes.co.uk,0,0,0,0,1,0
1029,20,2,2021,SCIDMARK ,3,Multiple waterline breaks due to software malfunction in the City of Bloomington,Water and wastewater sector and,Infrastructure,7,Water and Wastewater Systems,Critical Infrastructure,7,The Supervision Control and Data Acquisition (SCADA) system at the city's water treatment plant malfunctioned. The malfunction led to a factory worker accidentally activating too many bombs at once.,4.0,The malfunction caused a loss of control of the pumps temporarily until it was corrected and caused operational disruption throughout the city's water distribution system.,ibtimes.co.uk,0,0,0,0,1,0
1028,9,1,2021,SCIDMARK ,3,"Grid Frequency Deviation at ENTSO-E
",Energy,Energy,4,Energy,Energy,10,"The Continental European Power System, which spans 26 countries, recorded the highest absolute frequency deviation for nine seconds since 2006.",4.0,"The customer's core business production, core mission-critical applications or systems have been disrupted or have been so severely impacted that the business cannot reasonably continue to operate.",ibtimes.co.uk,0,0,0,1,0,0
1027,29,5,2019,SCIDMARK ,3,Ransomware attack against the municipality of Riviera Beach,Water and wastewater sector and,Infrastructure,7,Water and Wastewater Systems,Critical Infrastructure,7,"The city of Riviera, Florida was attacked using an unidentified ransomware, crippling most of the city's computer systems, including water utility pumping stations.",4.0,"The ransomware locked and encrypted all data contained on every hard drive for every system that was affected and impacted by the malware. No specific count of how many computers were infected, other than speculated numbers of 310 desktop computers and 90",ibtimes.co.uk,0,0,0,0,1,0
1026,11,7,2010,SCIDMARK ,3,Low Water Storage Due to Monitoring System Failure in the City of Lake Havasu,Water and wastewater sector and,Infrastructure,7,Water and Wastewater Systems,Critical Infrastructure,7,"The city of Lake Havasau, California, experienced a water shortage problem, causing thousands of local residents to be left without water; this was the report to be the first time since the city began keeping records.",4.0,Thousands of local residents were left without water.,ibtimes.co.uk,0,0,0,0,1,0
1025,1,5,2008,SCIDMARK ,3,Impacted SCADA/control systems that maintain operations at one or more locations have been tampered with.,Energy,Energy,4,Energy,Energy,10,An Upland man who worked for a company that operated offshore oil rigs was indicted on federal charges of damaging the company's computer systems after it refused to offer him permanent employment.,4.0,"Product operational features are not available with an acceptable workaround; however, there is no longer-than-expected timeframe or anticipated turnaround time. Customer implementation or core business production, core applications or mission-critical sy",ibtimes.co.uk,0,0,0,0,1,0
1024,24,8,2015,SCIDMARK ,3,Accidental sewage discharge due to operator error in the City of Honolulu,Water and wastewater sector and,Infrastructure,7,Water and Wastewater Systems,Critical Infrastructure,7,"The city reported the discharge of approximately 462,050 gallons of stormwater mixed with raw sewage into the state's waters from seven (7) culverts located in the Ala Moanal Kakaako area on August 24, 2015.",4.0,The spill continued and increased over approximately six (6) days.,ibtimes.co.uk,0,0,0,0,1,0
